DO $$
BEGIN
	IF EXISTS (SELECT 1 FROM pg_extension WHERE extname = 'pgturbohybrid') THEN
		EXECUTE 'DROP EXTENSION pgturbohybrid CASCADE';
	END IF;
	IF EXISTS (SELECT 1 FROM pg_extension WHERE extname = 'vector') THEN
		EXECUTE 'DROP EXTENSION vector CASCADE';
	END IF;
END
$$;
CREATE EXTENSION vector;
CREATE EXTENSION pgturbohybrid;
\pset format unaligned
SET turbohybrid.multivector_plain_fallback = off;
SELECT turbohybrid_multivector_dims(
  turbohybrid_multivector(ARRAY['[1,0]'::vector, '[0,1]'::vector])
) AS dims;
dims
2
(1 row)
SELECT turbohybrid_multivector_count(
  turbohybrid_multivector(ARRAY['[1,0]'::vector, '[0,1]'::vector])
) AS count;
count
2
(1 row)
SELECT turbohybrid_multivector_subvector(
  turbohybrid_multivector(ARRAY['[1,0]'::vector, '[0,1]'::vector]),
  1
)::text AS subvector_1;
subvector_1
[1,0]
(1 row)
SELECT turbohybrid_multivector_subvector(
  turbohybrid_multivector(ARRAY['[1,0]'::vector, '[0,1]'::vector]),
  2
)::text AS subvector_2;
subvector_2
[0,1]
(1 row)
SELECT turbohybrid_multivector(
  turbohybrid_multivector_to_vector_array(
    turbohybrid_multivector(ARRAY['[1,0]'::vector, '[0,1]'::vector])
  )
)::text AS mv_array_roundtrip;
mv_array_roundtrip
turbohybrid_multivector(dim=2,count=2,values=[[1,0],[0,1]])
(1 row)
SELECT turbohybrid_multivector_from_float4(ARRAY[1,0,0,1]::real[], 2)::text
  AS mv_float4;
mv_float4
turbohybrid_multivector(dim=2,count=2,values=[[1,0],[0,1]])
(1 row)
SELECT turbohybrid_multivector(
  turbohybrid_multivector_to_vector_array(
    turbohybrid_multivector_from_float4(ARRAY[1,0,0,1]::real[], 2)
  )
)::text AS mv_float4_roundtrip;
mv_float4_roundtrip
turbohybrid_multivector(dim=2,count=2,values=[[1,0],[0,1]])
(1 row)
DO $mv_float4$
DECLARE
	spec record;
BEGIN
	FOR spec IN
		SELECT 'dim_zero' AS name,
			   'SELECT turbohybrid_multivector_from_float4(ARRAY[1,0]::real[], 0)' AS sql
		UNION ALL
		SELECT 'length_not_divisible',
			   'SELECT turbohybrid_multivector_from_float4(ARRAY[1,0,1]::real[], 2)'
		UNION ALL
		SELECT 'empty_array',
			   'SELECT turbohybrid_multivector_from_float4(ARRAY[]::real[], 2)'
		UNION ALL
		SELECT 'null_element',
			   'SELECT turbohybrid_multivector_from_float4(ARRAY[1,NULL]::real[], 2)'
		UNION ALL
		SELECT 'nan_element',
			   $$SELECT turbohybrid_multivector_from_float4(ARRAY['NaN'::real,0]::real[], 2)$$
		UNION ALL
		SELECT 'infinite_element',
			   $$SELECT turbohybrid_multivector_from_float4(ARRAY['Infinity'::real,0]::real[], 2)$$
	LOOP
		BEGIN
			EXECUTE spec.sql;
			RAISE EXCEPTION 'expected turbohybrid_multivector_from_float4 case to fail: %',
				spec.name;
		EXCEPTION
			WHEN invalid_parameter_value OR data_exception OR null_value_not_allowed THEN
				NULL;
		END;
	END LOOP;
END
$mv_float4$;
DO $$
DECLARE
	ordinal int;
BEGIN
	FOREACH ordinal IN ARRAY ARRAY[0, 3]
	LOOP
		BEGIN
			PERFORM turbohybrid_multivector_subvector(
				turbohybrid_multivector(ARRAY['[1,0]'::vector, '[0,1]'::vector]),
				ordinal
			);
			RAISE EXCEPTION 'expected multivector subvector ordinal to fail: %',
				ordinal;
		EXCEPTION WHEN array_subscript_error THEN
			NULL;
		END;
	END LOOP;
END
$$;
SELECT turbohybrid_multivector(ARRAY['[1,0]'::vector, '[0,1]'::vector])::text AS mv_out;
mv_out
turbohybrid_multivector(dim=2,count=2,values=[[1,0],[0,1]])
(1 row)
SELECT turbohybrid_multivector(ARRAY['[1,0]'::vector, '[0,1]'::vector])::text::turbohybrid_multivector::text
  AS mv_roundtrip;
mv_roundtrip
turbohybrid_multivector(dim=2,count=2,values=[[1,0],[0,1]])
(1 row)
SELECT t.typsend::regproc::text AS mv_send,
       t.typreceive::regproc::text AS mv_recv
FROM pg_type t
WHERE t.typname = 'turbohybrid_multivector';
mv_send|mv_recv
turbohybrid_multivector_send|turbohybrid_multivector_recv
(1 row)
SELECT pg_catalog.length(
  turbohybrid_multivector_send(
    turbohybrid_multivector(ARRAY['[1,0]'::vector, '[0,1]'::vector])
  )
) AS mv_binary_len;
mv_binary_len
32
(1 row)
SELECT turbohybrid_multivector_dims(
  'turbohybrid_multivector(dim=2,count=1,values=[[1,0]])'::turbohybrid_multivector
) AS literal_dims;
literal_dims
2
(1 row)
SELECT ' turbohybrid_multivector ( dim = 2 , count = 1 , values = [ [ 1 , 0 ] ] ) '::turbohybrid_multivector::text
  AS mv_whitespace;
mv_whitespace
turbohybrid_multivector(dim=2,count=1,values=[[1,0]])
(1 row)
SELECT turbohybrid_multivector_maxsim(
  turbohybrid_multivector(ARRAY['[1,0]'::vector, '[0,1]'::vector]),
  turbohybrid_multivector(ARRAY['[1,0]'::vector, '[1,1]'::vector])
) AS maxsim;
maxsim
2
(1 row)
SELECT turbohybrid_multivector_maxsim_distance(
  turbohybrid_multivector(ARRAY['[1,0]'::vector, '[0,1]'::vector]),
  turbohybrid_multivector(ARRAY['[1,0]'::vector, '[1,1]'::vector])
) AS distance;
distance
-2
(1 row)
SELECT turbohybrid_multivector(ARRAY['[1,0]'::vector, '[1,1]'::vector]) <~>
  turbohybrid_query(multivector_query => turbohybrid_multivector(ARRAY['[1,0]'::vector, '[0,1]'::vector]))
  AS operator_distance;
operator_distance
-2
(1 row)
DO $$
DECLARE
	message text;
	detail text;
BEGIN
	BEGIN
		PERFORM turbohybrid_multivector(ARRAY['[1,0]'::vector]) <~>
			turbohybrid_query(
				multivector_query => turbohybrid_multivector(ARRAY['[1,0]'::vector]),
				text_query => to_tsquery('alpha')
			);
		RAISE EXCEPTION 'expected scalar multivector text fallback error';
	EXCEPTION WHEN feature_not_supported THEN
		GET STACKED DIAGNOSTICS message = MESSAGE_TEXT,
								detail = PG_EXCEPTION_DETAIL;
		IF message <> 'hybrid text queries require a turbohybrid index scan' OR
			detail <> 'Scalar multivector MaxSim can only evaluate the multivector payload.' THEN
			RAISE EXCEPTION 'unexpected scalar multivector fallback diagnostics: %, %',
				message, detail;
		END IF;
	END;
END
$$;
SELECT turbohybrid_multivector_maxsim(
  turbohybrid_multivector(ARRAY['[-1,0]'::vector]),
  turbohybrid_multivector(ARRAY['[2,0]'::vector, '[3,0]'::vector])
) AS negative_maxsim;
negative_maxsim
-2
(1 row)
CREATE TABLE sv_docs (
  id int,
  embedding vector(2)
);
INSERT INTO sv_docs VALUES
  (1, '[1,0]'::vector),
  (2, '[0,1]'::vector);
CREATE INDEX sv_docs_embedding_idx ON sv_docs USING turbohybrid
  (embedding vector_cosine_turbohybrid_ops);
SET enable_seqscan = off;
SELECT id FROM sv_docs
  ORDER BY embedding <~> turbohybrid_query(vector_query => '[1,0]'::vector)
  LIMIT 1;
id
1
(1 row)
DO $$
DECLARE
	stats jsonb;
BEGIN
	stats := turbohybrid_last_scan_stats();
	IF stats->>'multivector_enabled' <> 'false' OR
		(stats->>'multivector_query_vectors')::int <> 0 OR
		(stats->>'multivector_subvector_searches')::int <> 0 OR
		stats->>'multivector_exact_kernel' IS NOT NULL OR
		stats->>'multivector_accumulator_kind' IS NOT NULL THEN
		RAISE EXCEPTION 'expected single-vector scan to clear multivector stats, got %', stats;
	END IF;
END
$$;
RESET enable_seqscan;
DROP TABLE sv_docs;
CREATE TABLE mv_token_limit_docs (
  id int,
  colbert turbohybrid_multivector
);
INSERT INTO mv_token_limit_docs VALUES
  (1, turbohybrid_multivector(ARRAY['[1,0]'::vector, '[0,1]'::vector]));
CREATE INDEX mv_token_limit_docs_idx ON mv_token_limit_docs USING turbohybrid
  (colbert multivector_cosine_turbohybrid_ops);
SET enable_seqscan = off;
SET turbohybrid.multivector_unique_docs_per_token = 1;
SET turbohybrid.multivector_max_raw_hits_per_token = 10;
SELECT COUNT(*) AS result_count,
       COUNT(DISTINCT id) AS distinct_docs
FROM (
  SELECT id FROM mv_token_limit_docs
    ORDER BY colbert <~> turbohybrid_query(
      multivector_query => turbohybrid_multivector(ARRAY['[1,0]'::vector, '[0,1]'::vector]),
      dense_k => 4,
      final_k => 4
    )
    LIMIT 4
) s;
result_count|distinct_docs
1|1
(1 row)
DO $$
DECLARE
	stats jsonb;
BEGIN
	stats := turbohybrid_last_scan_stats();
	IF (stats->>'multivector_subvector_searches')::int <> 2 OR
		(stats->>'multivector_unique_docs')::int <> 2 OR
		(stats->>'multivector_doc_candidates')::int <> 1 OR
		stats->>'multivector_admission_debug_enabled' <> 'false' OR
		stats ? 'multivector_admission_trace' THEN
		RAISE EXCEPTION 'expected per-token unique doc accounting, got %', stats;
	END IF;
END
$$;
DO $$
DECLARE
	stats jsonb;
BEGIN
	PERFORM set_config('turbohybrid.multivector_debug_admission', 'summary', false);
	PERFORM id FROM mv_token_limit_docs
	  ORDER BY colbert <~> turbohybrid_query(
	    multivector_query => turbohybrid_multivector(ARRAY['[1,0]'::vector, '[0,1]'::vector]),
	    dense_k => 4,
	    final_k => 4
	  )
	  LIMIT 4;
	stats := turbohybrid_last_scan_stats();
	IF stats->>'multivector_admission_debug_enabled' <> 'true' OR
		(stats->>'multivector_admission_candidates_before_rerank')::int <> 1 OR
		(stats->>'multivector_admission_candidates_after_truncation')::int <> 1 OR
		(stats->>'multivector_admission_exact_rerank_docs')::int <> 1 OR
		stats->>'multivector_admission_truncated_by_doc_candidate_k' <> 'false' OR
		stats->>'multivector_admission_truncated_by_accumulator_memory' <> 'false' OR
		stats->>'multivector_admission_trace_available' <> 'false' OR
		stats ? 'multivector_admission_trace' THEN
		RAISE EXCEPTION 'expected summary admission diagnostics without trace, got %', stats;
	END IF;
	PERFORM set_config('turbohybrid.multivector_debug_admission', 'off', false);
END
$$;
DO $$
DECLARE
	stats jsonb;
	trace jsonb;
	first_entry jsonb;
BEGIN
	PERFORM set_config('turbohybrid.multivector_debug_admission', 'trace', false);
	PERFORM set_config('turbohybrid.multivector_debug_trace_limit', '1', false);
	PERFORM id FROM mv_token_limit_docs
	  ORDER BY colbert <~> turbohybrid_query(
	    multivector_query => turbohybrid_multivector(ARRAY['[1,0]'::vector, '[0,1]'::vector]),
	    dense_k => 4,
	    final_k => 4
	  )
	  LIMIT 4;
	stats := turbohybrid_last_scan_stats();
	trace := stats->'multivector_admission_trace';
	first_entry := trace->0;
	IF stats->>'multivector_admission_debug_enabled' <> 'true' OR
		stats->>'multivector_admission_trace_available' <> 'true' OR
		jsonb_typeof(trace) <> 'array' OR
		jsonb_array_length(trace) <> 1 OR
		NOT first_entry ? 'doc_id' OR
		NOT first_entry ? 'heap_tid' OR
		(first_entry->>'query_token_coverage_count')::int <> 2 OR
		(first_entry->>'raw_hit_count')::int <> 2 OR
		(first_entry->>'retained_for_exact_rerank') <> 'true' OR
		first_entry->>'exact_rerank_score' IS NULL THEN
		RAISE EXCEPTION 'expected bounded document-keyed admission trace, got %', stats;
	END IF;
	PERFORM set_config('turbohybrid.multivector_debug_trace_limit', '1000', false);
	PERFORM set_config('turbohybrid.multivector_debug_admission', 'off', false);
END
$$;
RESET turbohybrid.multivector_max_raw_hits_per_token;
RESET turbohybrid.multivector_unique_docs_per_token;
RESET enable_seqscan;
DROP TABLE mv_token_limit_docs;
CREATE TABLE mv_adaptive_docs (
  id int,
  colbert turbohybrid_multivector
);
INSERT INTO mv_adaptive_docs VALUES
  (1, turbohybrid_multivector(ARRAY['[1,0]'::vector])),
  (2, turbohybrid_multivector(ARRAY['[0.95,0.05]'::vector]));
CREATE INDEX mv_adaptive_docs_idx ON mv_adaptive_docs USING turbohybrid
  (colbert multivector_cosine_turbohybrid_ops);
SET enable_seqscan = off;
SET turbohybrid.multivector_subvector_k = 1;
SET turbohybrid.multivector_unique_docs_per_token = 2;
SET turbohybrid.multivector_max_raw_hits_per_token = 2;
SET turbohybrid.multivector_adaptive_widening = on;
SELECT COUNT(*) AS adaptive_result_count
FROM (
  SELECT id FROM mv_adaptive_docs
    ORDER BY colbert <~> turbohybrid_query(
      multivector_query => turbohybrid_multivector(ARRAY['[1,0]'::vector]),
      dense_k => 2,
      final_k => 2
    )
    LIMIT 2
) s;
adaptive_result_count
2
(1 row)
DO $$
DECLARE
	stats jsonb;
BEGIN
	stats := turbohybrid_last_scan_stats();
	IF stats->>'multivector_adaptive_widening_triggered' <> 'true' OR
		(stats->>'multivector_adaptive_initial_raw_target')::int <> 1 OR
		(stats->>'multivector_adaptive_final_raw_target')::int <> 2 OR
		(stats->>'multivector_raw_subvector_hits')::int > 2 THEN
		RAISE EXCEPTION 'expected adaptive multivector widening to reach cap, got %', stats;
	END IF;
END
$$;
SET turbohybrid.multivector_adaptive_widening = off;
SELECT COUNT(*) AS fixed_result_count
FROM (
  SELECT id FROM mv_adaptive_docs
    ORDER BY colbert <~> turbohybrid_query(
      multivector_query => turbohybrid_multivector(ARRAY['[1,0]'::vector]),
      dense_k => 2,
      final_k => 2
    )
    LIMIT 2
) s;
fixed_result_count
2
(1 row)
DO $$
DECLARE
	stats jsonb;
BEGIN
	stats := turbohybrid_last_scan_stats();
	IF stats->>'multivector_adaptive_widening_triggered' <> 'false' OR
		(stats->>'multivector_adaptive_initial_raw_target')::int <> 2 OR
		(stats->>'multivector_adaptive_final_raw_target')::int <> 2 THEN
		RAISE EXCEPTION 'expected fixed multivector raw target when adaptive widening is off, got %', stats;
	END IF;
END
$$;
RESET turbohybrid.multivector_adaptive_widening;
RESET turbohybrid.multivector_max_raw_hits_per_token;
RESET turbohybrid.multivector_unique_docs_per_token;
RESET turbohybrid.multivector_subvector_k;
RESET enable_seqscan;
DROP TABLE mv_adaptive_docs;
CREATE TABLE mv_docs (
  id int,
  colbert turbohybrid_multivector,
  body_tsv tsvector
);
INSERT INTO mv_docs VALUES
  (1, turbohybrid_multivector(ARRAY['[1,0]'::vector, '[0.8,0.2]'::vector]), to_tsvector('alpha beta')),
  (2, turbohybrid_multivector(ARRAY['[0,1]'::vector, '[0.2,0.8]'::vector]), to_tsvector('gamma delta')),
  (3, turbohybrid_multivector(ARRAY['[0.95,0.05]'::vector, '[0,1]'::vector]), to_tsvector('alpha gamma'));
\set VERBOSITY terse
CREATE INDEX mv_docs_colbert_idx ON mv_docs USING turbohybrid
  (colbert multivector_cosine_turbohybrid_ops);
DO $$
DECLARE
	stats jsonb;
BEGIN
	stats := turbohybrid_index_stats('mv_docs_colbert_idx'::regclass);
	IF (stats->>'node_count')::int <> 6 THEN
		RAISE EXCEPTION 'expected multivector build to create 6 graph nodes, got %',
			stats->>'node_count';
	END IF;
END
$$;
SELECT id FROM mv_docs
  ORDER BY colbert <~> turbohybrid_query(
    multivector_query => turbohybrid_multivector(ARRAY['[1,0]'::vector])
  )
  LIMIT 1;
id
1
(1 row)
SET enable_seqscan = off;
SELECT id FROM mv_docs
  ORDER BY colbert <~> turbohybrid_query(
    multivector_query => turbohybrid_multivector(ARRAY['[1,0]'::vector])
  )
  LIMIT 1;
id
1
(1 row)
DO $$
DECLARE
	stats jsonb;
BEGIN
	stats := turbohybrid_last_scan_stats();
	IF stats->>'index_used' <> 'true' OR
		stats->>'dense_branch_used' <> 'true' OR
		(stats->>'dense_candidates')::int < 1 OR
		stats->>'exact_rescore_source' <> 'heap' OR
		(stats->>'heap_rescore_count')::int < 1 OR
		stats->>'multivector_enabled' <> 'true' OR
		(stats->>'multivector_query_vectors')::int <> 1 OR
		(stats->>'multivector_doc_vectors_limit')::int < 1 OR
		(stats->>'multivector_subvector_searches')::int <> 1 OR
		(stats->>'multivector_raw_subvector_hits')::int < 1 OR
		(stats->>'multivector_unique_docs')::int < 1 OR
		(stats->>'multivector_maxsim_updates')::int < 1 OR
		(stats->>'multivector_doc_candidates')::int < 1 OR
		stats->>'multivector_exact_rerank_enabled' <> 'true' OR
		(stats->>'multivector_exact_rerank_docs')::int < 1 OR
		(stats->>'multivector_exact_rerank_pairs')::int < 1 OR
		stats->>'multivector_exact_kernel' IS NULL OR
		stats->>'multivector_accumulator_kind' <> 'docid_hash_slab' OR
		stats->>'multivector_docmap_source' <> 'sidecar' OR
		(stats->>'multivector_docmap_bytes')::bigint < 1 OR
		(stats->>'multivector_memory_bytes_estimate')::bigint < 1 OR
		(stats->>'multivector_memory_bytes_estimate')::bigint > 1048576 THEN
		RAISE EXCEPTION 'expected indexed multivector dense scan, got %', stats;
	END IF;
END
$$;
DO $$
DECLARE
	memory_stats jsonb;
BEGIN
	memory_stats := turbohybrid_estimate_memory('mv_docs_colbert_idx'::regclass);
	IF (memory_stats->'native'->>'multivector_docmap_bytes')::bigint < 1 THEN
		RAISE EXCEPTION 'expected multivector docmap bytes in memory estimate, got %',
			memory_stats;
	END IF;
END
$$;
SET turbohybrid.multivector_docmap = off;
SELECT id FROM mv_docs
  ORDER BY colbert <~> turbohybrid_query(
    multivector_query => turbohybrid_multivector(ARRAY['[1,0]'::vector])
  )
  LIMIT 1;
id
1
(1 row)
DO $$
DECLARE
	stats jsonb;
BEGIN
	stats := turbohybrid_last_scan_stats();
	IF stats->>'multivector_docmap_source' <> 'heap_tid_hash' OR
		(stats->>'multivector_docmap_bytes')::bigint <> 0 THEN
		RAISE EXCEPTION 'expected forced heap-TID docmap fallback, got %', stats;
	END IF;
END
$$;
SET turbohybrid.multivector_docmap = require;
SELECT id FROM mv_docs
  ORDER BY colbert <~> turbohybrid_query(
    multivector_query => turbohybrid_multivector(ARRAY['[1,0]'::vector])
  )
  LIMIT 1;
id
1
(1 row)
DO $$
DECLARE
	stats jsonb;
BEGIN
	stats := turbohybrid_last_scan_stats();
	IF stats->>'multivector_docmap_source' <> 'sidecar' OR
		(stats->>'multivector_docmap_bytes')::bigint < 1 THEN
		RAISE EXCEPTION 'expected required multivector docmap sidecar, got %',
			stats;
	END IF;
END
$$;
RESET turbohybrid.multivector_docmap;
SET turbohybrid.default_dense_k = 7;
SELECT id FROM mv_docs
  ORDER BY colbert <~> turbohybrid_query(
    multivector_query => turbohybrid_multivector(ARRAY['[1,0]'::vector]),
    dense_k => NULL
  )
  LIMIT 1;
id
1
(1 row)
DO $$
DECLARE
	stats jsonb;
BEGIN
	stats := turbohybrid_last_scan_stats();
	IF stats->>'multivector_enabled' <> 'true' OR
		(stats->>'dense_candidates_effective')::int <> 7 THEN
		RAISE EXCEPTION 'expected multivector default dense_k to use dense budget, got %',
			stats;
	END IF;
END
$$;
RESET turbohybrid.default_dense_k;
SET turbohybrid.multivector_exact_rerank = off;
SELECT id FROM mv_docs
  ORDER BY colbert <~> turbohybrid_query(
    multivector_query => turbohybrid_multivector(ARRAY['[1,0]'::vector])
  )
  LIMIT 1;
id
1
(1 row)
DO $$
DECLARE
	stats jsonb;
BEGIN
	stats := turbohybrid_last_scan_stats();
	IF stats->>'index_used' <> 'true' OR
		stats->>'exact_rescore_source' <> 'none' OR
		(stats->>'heap_rescore_count')::int <> 0 OR
		stats->>'multivector_exact_rerank_enabled' <> 'false' OR
		(stats->>'multivector_exact_rerank_docs')::int <> 0 OR
		(stats->>'multivector_exact_rerank_pairs')::int <> 0 OR
		stats->>'multivector_exact_kernel' IS NOT NULL THEN
		RAISE EXCEPTION 'expected multivector exact rerank off stats, got %', stats;
	END IF;
END
$$;
RESET turbohybrid.multivector_exact_rerank;
SELECT COUNT(*) AS result_count,
       COUNT(DISTINCT id) AS distinct_docs
FROM (
  SELECT id FROM mv_docs
    ORDER BY colbert <~> turbohybrid_query(
      multivector_query => turbohybrid_multivector(ARRAY['[1,0]'::vector, '[0,1]'::vector]),
      dense_k => 6,
      final_k => 3
    )
    LIMIT 3
) s;
result_count|distinct_docs
3|3
(1 row)
SET turbohybrid.multivector_doc_candidate_k = 2;
SELECT COUNT(*) AS result_count,
       COUNT(DISTINCT id) AS distinct_docs
FROM (
  SELECT id FROM mv_docs
    ORDER BY colbert <~> turbohybrid_query(
      multivector_query => turbohybrid_multivector(ARRAY['[1,0]'::vector, '[0,1]'::vector]),
      dense_k => 6,
      final_k => 3
    )
    LIMIT 3
) s;
result_count|distinct_docs
2|2
(1 row)
DO $$
DECLARE
	stats jsonb;
BEGIN
	stats := turbohybrid_last_scan_stats();
	IF (stats->>'multivector_doc_candidates')::int <> 2 THEN
		RAISE EXCEPTION 'expected bounded multivector candidate heap to retain 2 docs, got %',
			stats;
	END IF;
END
$$;
RESET turbohybrid.multivector_doc_candidate_k;
RESET enable_seqscan;
CREATE TABLE mv_alias_cosine_docs (
  id int,
  colbert turbohybrid_multivector
);
CREATE TABLE mv_alias_ip_docs (
  id int,
  colbert turbohybrid_multivector
);
INSERT INTO mv_alias_cosine_docs VALUES
  (1, turbohybrid_multivector(ARRAY['[1,0]'::vector, '[0.8,0.2]'::vector])),
  (2, turbohybrid_multivector(ARRAY['[0,1]'::vector, '[0.2,0.8]'::vector])),
  (3, turbohybrid_multivector(ARRAY['[0.95,0.05]'::vector, '[0,1]'::vector]));
INSERT INTO mv_alias_ip_docs SELECT * FROM mv_alias_cosine_docs;
CREATE INDEX mv_alias_cosine_idx ON mv_alias_cosine_docs USING turbohybrid
  (colbert multivector_cosine_turbohybrid_ops);
CREATE INDEX mv_alias_ip_idx ON mv_alias_ip_docs USING turbohybrid
  (colbert multivector_maxsim_ip_turbohybrid_ops);
SET enable_seqscan = off;
WITH cosine_results AS (
  SELECT pg_catalog.array_agg(id) AS ids
  FROM (
    SELECT id FROM mv_alias_cosine_docs
      ORDER BY colbert <~> turbohybrid_query(
        multivector_query => turbohybrid_multivector(ARRAY['[1,0]'::vector, '[0,1]'::vector]),
        dense_k => 6,
        final_k => 3
      )
      LIMIT 3
  ) s
),
ip_results AS (
  SELECT pg_catalog.array_agg(id) AS ids
  FROM (
    SELECT id FROM mv_alias_ip_docs
      ORDER BY colbert <~> turbohybrid_query(
        multivector_query => turbohybrid_multivector(ARRAY['[1,0]'::vector, '[0,1]'::vector]),
        dense_k => 6,
        final_k => 3
      )
      LIMIT 3
  ) s
)
SELECT cosine_results.ids = ip_results.ids AS maxsim_ip_alias_same_order
FROM cosine_results, ip_results;
maxsim_ip_alias_same_order
t
(1 row)
RESET enable_seqscan;
DROP TABLE mv_alias_cosine_docs;
DROP TABLE mv_alias_ip_docs;
CREATE TABLE mv_recall_docs (
  id int,
  colbert turbohybrid_multivector
);
INSERT INTO mv_recall_docs VALUES
  (1, turbohybrid_multivector(ARRAY['[1,0]'::vector, '[0,1]'::vector])),
  (2, turbohybrid_multivector(ARRAY['[0.9,0.1]'::vector, '[0.1,0.9]'::vector])),
  (3, turbohybrid_multivector(ARRAY['[0.8,0.2]'::vector, '[0.3,0.7]'::vector])),
  (4, turbohybrid_multivector(ARRAY['[0.6,0.4]'::vector, '[0.2,0.6]'::vector])),
  (5, turbohybrid_multivector(ARRAY['[-1,0]'::vector, '[0,-1]'::vector])),
  (6, turbohybrid_multivector(ARRAY['[0.4,0.6]'::vector, '[0.5,0.5]'::vector]));
CREATE INDEX mv_recall_docs_idx ON mv_recall_docs USING turbohybrid
  (colbert multivector_maxsim_ip_turbohybrid_ops);
SET enable_seqscan = off;
SET turbohybrid.multivector_doc_candidate_k = 8;
SET turbohybrid.multivector_unique_docs_per_token = 8;
SET turbohybrid.multivector_max_raw_hits_per_token = 64;
WITH q AS (
  SELECT turbohybrid_multivector(ARRAY['[1,0]'::vector, '[0,1]'::vector]) AS mv
),
brute AS (
  SELECT pg_catalog.array_agg(id ORDER BY dist, id) AS ids
  FROM (
    SELECT id, turbohybrid_multivector_maxsim_distance(q.mv, colbert) AS dist
    FROM mv_recall_docs, q
    ORDER BY dist, id
    LIMIT 5
  ) s
),
indexed AS (
  SELECT pg_catalog.array_agg(id ORDER BY ord) AS ids
  FROM (
    SELECT id, row_number() OVER () AS ord
    FROM mv_recall_docs, q
    ORDER BY colbert <~> turbohybrid_query(
      multivector_query => q.mv,
      dense_k => 12,
      final_k => 5
    )
    LIMIT 5
  ) s
)
SELECT brute.ids = indexed.ids AS multivector_index_matches_bruteforce
FROM brute, indexed;
multivector_index_matches_bruteforce
t
(1 row)
RESET turbohybrid.multivector_max_raw_hits_per_token;
RESET turbohybrid.multivector_unique_docs_per_token;
RESET turbohybrid.multivector_doc_candidate_k;
RESET enable_seqscan;
DROP TABLE mv_recall_docs;
CREATE TABLE mv_insert_batch_dense_docs (
  id int,
  colbert turbohybrid_multivector
);
INSERT INTO mv_insert_batch_dense_docs VALUES
  (1, turbohybrid_multivector(ARRAY['[0,1]'::vector]));
CREATE INDEX mv_insert_batch_dense_idx ON mv_insert_batch_dense_docs USING turbohybrid
  (colbert multivector_cosine_turbohybrid_ops);
INSERT INTO mv_insert_batch_dense_docs VALUES
  (2, turbohybrid_multivector(ARRAY[
    '[1,0]'::vector,
    '[0.8,0.2]'::vector,
    '[0.6,0.4]'::vector
  ]));
DO $$
DECLARE
	stats jsonb;
BEGIN
	stats := turbohybrid_index_stats('mv_insert_batch_dense_idx'::regclass);
	IF (stats->>'node_count')::int <> 4 THEN
		RAISE EXCEPTION 'expected 3-token multivector insert to append three dense nodes, got %',
			stats->>'node_count';
	END IF;
END
$$;
SET enable_seqscan = off;
SELECT id FROM mv_insert_batch_dense_docs
  ORDER BY colbert <~> turbohybrid_query(
    multivector_query => turbohybrid_multivector(ARRAY['[1,0]'::vector]),
    dense_k => 4,
    final_k => 1
  )
  LIMIT 1;
id
2
(1 row)
RESET enable_seqscan;
DROP TABLE mv_insert_batch_dense_docs;
CREATE TABLE mv_insert_batch_hybrid_docs (
  id int,
  colbert turbohybrid_multivector,
  body_tsv tsvector
);
INSERT INTO mv_insert_batch_hybrid_docs VALUES
  (1, turbohybrid_multivector(ARRAY['[0,1]'::vector]), to_tsvector('alpha'));
CREATE INDEX mv_insert_batch_hybrid_idx ON mv_insert_batch_hybrid_docs USING turbohybrid
  (colbert multivector_cosine_turbohybrid_ops,
   body_tsv bm25_tsvector_turbohybrid_ops);
INSERT INTO mv_insert_batch_hybrid_docs VALUES
  (2, turbohybrid_multivector(ARRAY[
    '[1,0]'::vector,
    '[0.8,0.2]'::vector,
    '[0.6,0.4]'::vector
  ]), to_tsvector('batchterm'));
DO $$
DECLARE
	stats jsonb;
BEGIN
	stats := turbohybrid_index_stats('mv_insert_batch_hybrid_idx'::regclass);
	IF (stats->>'node_count')::int <> 4 THEN
		RAISE EXCEPTION 'expected 3-token hybrid multivector insert to append three dense nodes, got %',
			stats->>'node_count';
	END IF;
END
$$;
SET enable_seqscan = off;
SELECT id FROM mv_insert_batch_hybrid_docs
	ORDER BY colbert <~> turbohybrid_query(
		multivector_query => turbohybrid_multivector(ARRAY['[1,0]'::vector]),
		text_query => to_tsquery('batchterm'),
		dense_k => 4,
		bm25_k => 4,
		final_k => 4,
		fusion => 'rrf'
	)
	LIMIT 4;
id
2
1
(2 rows)
RESET enable_seqscan;
DROP TABLE mv_insert_batch_hybrid_docs;
CREATE TABLE mv_bm25_injection_docs (
  id text PRIMARY KEY,
  colbert turbohybrid_multivector,
  body_tsv tsvector
);
INSERT INTO mv_bm25_injection_docs VALUES
  ('spike', turbohybrid_multivector(ARRAY['[1,0]'::vector]), to_tsvector('simple', 'spikeonly')),
  ('spike_y', turbohybrid_multivector(ARRAY['[0,1]'::vector]), to_tsvector('simple', 'spikeonly')),
  ('good', turbohybrid_multivector(ARRAY[
    '[0.8,0.2]'::vector,
    '[0.2,0.8]'::vector
  ]), to_tsvector('simple', 'needle')),
  ('weak_needle', turbohybrid_multivector(ARRAY['[-1,0]'::vector]), to_tsvector('simple', 'needle'));
CREATE INDEX mv_bm25_injection_idx ON mv_bm25_injection_docs USING turbohybrid
  (colbert multivector_cosine_turbohybrid_ops,
   body_tsv bm25_tsvector_turbohybrid_ops)
  WITH (graph_m = 4, graph_ef_construction = 8, graph_ef_search = 8);
ANALYZE mv_bm25_injection_docs;
SET enable_seqscan = off;
SET turbohybrid.multivector_plain_fallback = off;
SET turbohybrid.multivector_candidate_source = exact_token_scan;
SET turbohybrid.multivector_candidate_reservoirs = off;
SET turbohybrid.multivector_subvector_k = 1;
SET turbohybrid.multivector_unique_docs_per_token = 1;
SET turbohybrid.multivector_max_raw_hits_per_token = 1;
SET turbohybrid.multivector_doc_candidate_k = 1;
SET turbohybrid.multivector_exact_rerank_k = 1;
DO $$
DECLARE
	q turbohybrid_multivector := turbohybrid_multivector(ARRAY[
		'[1,0]'::vector,
		'[0,1]'::vector
	]);
	top_id text;
	stats jsonb;
BEGIN
	SET LOCAL turbohybrid.multivector_bm25_candidate_injection = off;
	SELECT id INTO top_id
	FROM mv_bm25_injection_docs
	ORDER BY colbert <~> turbohybrid_query(
	  multivector_query => q,
	  text_query => to_tsquery('simple', 'needle'),
	  dense_k => 1,
	  bm25_k => 2,
	  final_k => 1,
	  bm25_weight => 0
	)
	LIMIT 1;
	stats := turbohybrid_last_scan_stats();
	IF top_id NOT IN ('spike', 'spike_y') OR
		stats->>'multivector_bm25_injection_enabled' <> 'false' THEN
		RAISE EXCEPTION 'expected BM25 injection off to leave dense miss in place, top %, stats %',
			top_id, stats;
	END IF;

	SET LOCAL turbohybrid.multivector_bm25_candidate_injection = dense_with_text;
	SELECT id INTO top_id
	FROM mv_bm25_injection_docs
	ORDER BY colbert <~> turbohybrid_query(
	  multivector_query => q,
	  text_query => to_tsquery('simple', 'needle'),
	  dense_k => 1,
	  bm25_k => 2,
	  final_k => 1,
	  bm25_weight => 0
	)
	LIMIT 1;
	stats := turbohybrid_last_scan_stats();
	IF top_id <> 'good' OR
		stats->>'multivector_bm25_injection_enabled' <> 'true' OR
		(stats->>'multivector_bm25_injection_candidates')::int < 1 OR
		(stats->>'multivector_bm25_injection_retained')::int < 1 OR
		(stats->>'multivector_bm25_injection_exact_reranked')::int < 1 THEN
		RAISE EXCEPTION 'expected dense_with_text BM25 injection to admit exact-MaxSim winner, top %, stats %',
			top_id, stats;
	END IF;
	IF stats->>'fusion_strategy' NOT IN ('sorted_merge_doc', 'hash_doc') THEN
		RAISE EXCEPTION 'expected document-keyed fusion after injection, got %',
			stats;
	END IF;

	SET LOCAL turbohybrid.multivector_bm25_candidate_injection = hybrid_only;
	SELECT id INTO top_id
	FROM mv_bm25_injection_docs
	ORDER BY colbert <~> turbohybrid_query(
	  multivector_query => q,
	  text_query => to_tsquery('simple', 'needle'),
	  dense_k => 1,
	  bm25_k => 2,
	  final_k => 2,
	  fusion => 'rrf'
	)
	LIMIT 1;
	stats := turbohybrid_last_scan_stats();
	IF stats->>'multivector_bm25_injection_enabled' <> 'true' OR
		stats->>'fusion_strategy' NOT IN ('sorted_merge_doc', 'hash_doc') THEN
		RAISE EXCEPTION 'expected hybrid_only injection to preserve document-keyed RRF, top %, stats %',
			top_id, stats;
	END IF;
END
$$;
DO $$
DECLARE
	q turbohybrid_multivector := turbohybrid_multivector(ARRAY[
		'[1,0]'::vector,
		'[0,1]'::vector
	]);
	top_id text;
	stats jsonb;
BEGIN
	SET LOCAL turbohybrid.multivector_candidate_source = exact_doc_scan;
	SELECT id INTO top_id
	FROM mv_bm25_injection_docs
	ORDER BY colbert <~> turbohybrid_query(
	  multivector_query => q,
	  dense_k => 1,
	  final_k => 1
	)
	LIMIT 1;
	stats := turbohybrid_last_scan_stats();
	IF top_id <> 'good' OR
		stats->>'multivector_candidate_source' <> 'exact_doc_scan' OR
		stats->>'multivector_plain_fallback_reason' <> 'exact_doc_scan' OR
		stats->>'multivector_doc_graph_prototype_enabled' <> 'false' THEN
		RAISE EXCEPTION 'expected exact_doc_scan to exact-score documents, top %, stats %',
			top_id, stats;
	END IF;

	SET LOCAL turbohybrid.multivector_candidate_source = doc_graph_prototype;
	SELECT id INTO top_id
	FROM mv_bm25_injection_docs
	ORDER BY colbert <~> turbohybrid_query(
	  multivector_query => q,
	  dense_k => 1,
	  final_k => 1
	)
	LIMIT 1;
	stats := turbohybrid_last_scan_stats();
	IF top_id <> 'good' OR
		stats->>'multivector_candidate_source' <> 'doc_graph_prototype' OR
		stats->>'multivector_doc_graph_prototype_enabled' <> 'true' OR
		(stats->>'multivector_doc_graph_docs_scored')::int <> 4 OR
		(stats->>'multivector_doc_graph_candidates')::int <> 1 OR
		(stats->>'multivector_doc_graph_heap_fetches')::int <> 4 OR
		stats->>'multivector_doc_graph_warning' <>
			'prototype_heap_scan_no_index_resident_doc_graph' THEN
		RAISE EXCEPTION 'expected doc_graph_prototype heap-scan stats, top %, stats %',
			top_id, stats;
	END IF;
END
$$;
DO $$
BEGIN
	BEGIN
		SET LOCAL turbohybrid.multivector_candidate_source = document_nodes;
		PERFORM id
		FROM mv_bm25_injection_docs
		ORDER BY colbert <~> turbohybrid_query(
		  multivector_query => turbohybrid_multivector(ARRAY['[1,0]'::vector]),
		  dense_k => 1,
		  final_k => 1
		)
		LIMIT 1;
		RAISE EXCEPTION 'expected document_nodes source on token-node index to fail';
	EXCEPTION
		WHEN feature_not_supported THEN
			IF SQLERRM NOT LIKE '%requires multivector_graph = document_nodes%' THEN
				RAISE EXCEPTION 'unexpected document_nodes token-node error: %', SQLERRM;
			END IF;
	END;
END
$$;
DO $$
BEGIN
	BEGIN
		PERFORM id
		FROM mv_docs
		ORDER BY colbert <~> turbohybrid_query(
		  multivector_query => turbohybrid_multivector(ARRAY['[1,0]'::vector]),
		  text_query => to_tsquery('simple', 'needle'),
		  dense_k => 1,
		  bm25_k => 1,
		  final_k => 1
		)
		LIMIT 1;
		RAISE EXCEPTION 'expected text_query on non-lexical multivector index to fail';
	EXCEPTION
		WHEN feature_not_supported THEN
			NULL;
	END;
END
$$;
DROP TABLE mv_bm25_injection_docs;
RESET turbohybrid.multivector_bm25_candidate_injection;
RESET turbohybrid.multivector_exact_rerank_k;
RESET turbohybrid.multivector_candidate_source;
RESET turbohybrid.multivector_candidate_reservoirs;
SET turbohybrid.multivector_plain_fallback = off;
RESET turbohybrid.multivector_doc_candidate_k;
RESET turbohybrid.multivector_max_raw_hits_per_token;
RESET turbohybrid.multivector_unique_docs_per_token;
RESET turbohybrid.multivector_subvector_k;
RESET enable_seqscan;
DROP INDEX mv_docs_colbert_idx;
CREATE INDEX mv_docs_hybrid_idx ON mv_docs USING turbohybrid
  (colbert multivector_cosine_turbohybrid_ops,
   body_tsv bm25_tsvector_turbohybrid_ops);
INSERT INTO mv_docs VALUES
  (4, turbohybrid_multivector(ARRAY['[-1,-1]'::vector, '[-0.8,-1.2]'::vector]), to_tsvector('epsilon'));
SET enable_seqscan = off;
DO $$
DECLARE
	stats jsonb;
BEGIN
	stats := turbohybrid_index_stats('mv_docs_hybrid_idx'::regclass);
	IF (stats->>'node_count')::int <> 8 THEN
		RAISE EXCEPTION 'expected multivector insert to append two graph nodes, got %',
			stats->>'node_count';
	END IF;
END
$$;
SELECT id FROM mv_docs
  ORDER BY colbert <~> turbohybrid_query(
    multivector_query => turbohybrid_multivector(ARRAY['[-1,-1]'::vector]),
    dense_k => 8,
    final_k => 1
  )
  LIMIT 1;
id
4
(1 row)
DO $$
DECLARE
	stats jsonb;
	memory_stats jsonb;
BEGIN
	stats := turbohybrid_last_scan_stats();
	memory_stats := turbohybrid_estimate_memory('mv_docs_hybrid_idx'::regclass);
	IF stats->>'multivector_docmap_source' <> 'sidecar' OR
		(stats->>'multivector_docmap_bytes')::bigint < 1 OR
		(memory_stats->'native'->>'multivector_docmap_bytes')::bigint < 1 THEN
		RAISE EXCEPTION 'expected inserted multivector docmap sidecar, scan %, memory %',
			stats, memory_stats;
	END IF;
END
$$;
SELECT id FROM mv_docs
  ORDER BY colbert <~> turbohybrid_query(
    multivector_query => turbohybrid_multivector(ARRAY['[-1,-1]'::vector]),
    text_query => to_tsquery('epsilon'),
    dense_k => 8,
    bm25_k => 3,
    final_k => 1,
    fusion => 'rrf'
  )
  LIMIT 1;
id
4
(1 row)
SELECT id FROM mv_docs
  ORDER BY colbert <~> turbohybrid_query(
    multivector_query => turbohybrid_multivector(ARRAY['[1,0]'::vector]),
    text_query => to_tsquery('gamma'),
    dense_k => 6,
    bm25_k => 3,
    final_k => 3,
    fusion => 'rrf'
  )
  LIMIT 1;
id
2
(1 row)
DO $$
DECLARE
	stats jsonb;
BEGIN
	stats := turbohybrid_last_scan_stats();
	IF stats->>'index_used' <> 'true' OR
		stats->>'dense_branch_used' <> 'true' OR
		stats->>'bm25_branch_used' <> 'true' OR
		(stats->>'both_match')::int < 1 OR
		stats->>'fusion_strategy' NOT IN ('sorted_merge_doc', 'hash_doc') THEN
		RAISE EXCEPTION 'expected indexed multivector hybrid scan, got %', stats;
	END IF;
END
$$;
SELECT id FROM mv_docs
  ORDER BY colbert <~> turbohybrid_query(
    multivector_query => turbohybrid_multivector(ARRAY['[1,0]'::vector, '[0,1]'::vector]),
    text_query => to_tsquery('alpha | gamma'),
    dense_k => 6,
    bm25_k => 3,
    final_k => 3,
    fusion => 'rrf'
  )
  LIMIT 3;
id
3
1
2
(3 rows)
SELECT id FROM mv_docs
  ORDER BY colbert <~> turbohybrid_query(
    multivector_query => turbohybrid_multivector(ARRAY['[1,0]'::vector]),
    dense_k => 6,
    final_k => 1,
    fusion => 'weighted'
  )
  LIMIT 1;
id
1
(1 row)
SELECT id FROM mv_docs
  ORDER BY colbert <~> turbohybrid_query(
    multivector_query => turbohybrid_multivector(ARRAY['[1,0]'::vector]),
    text_query => to_tsquery('gamma'),
    fusion => 'weighted'
  )
  LIMIT 1;
id
3
(1 row)
DO $$
DECLARE
	stats jsonb;
BEGIN
	stats := turbohybrid_last_scan_stats();
	IF stats->>'fusion_strategy' NOT IN ('sorted_merge_doc', 'hash_doc') OR
		(stats->>'both_match')::int < 1 THEN
		RAISE EXCEPTION 'expected weighted multivector hybrid fusion, got %',
			stats;
	END IF;
END
$$;
SELECT id FROM mv_docs
  ORDER BY colbert <~> turbohybrid_query(
    multivector_query => turbohybrid_multivector(ARRAY['[1,0]'::vector]),
    text_query => to_tsquery('gamma'),
    fusion => 'fast_weighted'
  )
  LIMIT 1;
id
2
(1 row)
DO $$
DECLARE
	stats jsonb;
BEGIN
	stats := turbohybrid_last_scan_stats();
	IF stats->>'fusion_strategy' NOT IN ('sorted_merge_doc', 'hash_doc') OR
		(stats->>'fast_weighted_enabled')::boolean IS DISTINCT FROM true OR
		stats->>'dense_norm_mode' <> 'logistic' OR
		stats->>'bm25_norm_mode' <> 'saturating' THEN
		RAISE EXCEPTION 'expected normalized fast_weighted multivector hybrid fusion, got %',
			stats;
	END IF;
END
$$;
SELECT id FROM mv_docs
  ORDER BY colbert <~> turbohybrid_query(
    multivector_query => turbohybrid_multivector(ARRAY['[1,0]'::vector]),
    text_query => to_tsquery('gamma'),
    fusion => 'calibrated'
  )
  LIMIT 1;
id
3
(1 row)
DO $$
DECLARE
	stats jsonb;
BEGIN
	stats := turbohybrid_last_scan_stats();
	IF stats->>'fusion_strategy' NOT IN ('sorted_merge_doc', 'hash_doc') OR
		(stats->>'calibrated_fusion_enabled')::boolean IS DISTINCT FROM true OR
		stats->>'calibrated_fusion_dense_norm_mode' <> 'logistic' OR
		stats->>'calibrated_fusion_bm25_norm_mode' <> 'saturating' THEN
		RAISE EXCEPTION 'expected calibrated multivector hybrid fusion, got %',
			stats;
	END IF;
END
$$;
CREATE TABLE mv_docnode_hybrid_scheduler_docs (
  id text PRIMARY KEY,
  colbert turbohybrid_multivector,
  body_tsv tsvector
);
INSERT INTO mv_docnode_hybrid_scheduler_docs VALUES
  ('dense_a', turbohybrid_multivector(ARRAY[
    '[1,0]'::vector,
    '[0,1]'::vector
  ]), to_tsvector('simple', 'common alpha')),
  ('dense_b', turbohybrid_multivector(ARRAY[
    '[0.9,0.1]'::vector,
    '[0.1,0.9]'::vector
  ]), to_tsvector('simple', 'common beta')),
  ('lexical_only', turbohybrid_multivector(ARRAY[
    '[-1,0]'::vector,
    '[0,-1]'::vector
  ]), to_tsvector('simple', 'common needle')),
  ('mixed', turbohybrid_multivector(ARRAY[
    '[0.8,0.2]'::vector,
    '[0.2,0.8]'::vector
  ]), to_tsvector('simple', 'common needle'));
CREATE INDEX mv_docnode_hybrid_scheduler_idx
  ON mv_docnode_hybrid_scheduler_docs USING turbohybrid
  (colbert multivector_cosine_turbohybrid_ops,
   body_tsv bm25_tsvector_turbohybrid_ops)
  WITH (multivector_graph = document_nodes,
        graph_m = 4,
        graph_ef_construction = 8,
        graph_ef_search = 4);
ANALYZE mv_docnode_hybrid_scheduler_docs;
DO $$
DECLARE
	stats jsonb;
	top_id text;
BEGIN
	PERFORM set_config('turbohybrid.hybrid_budget_policy', 'adaptive', true);
	PERFORM set_config('turbohybrid.multivector_candidate_source', 'document_nodes', true);
	PERFORM set_config('turbohybrid.default_dense_k', '64', true);
	PERFORM set_config('turbohybrid.default_bm25_k', '64', true);

	SELECT id INTO top_id
	FROM mv_docnode_hybrid_scheduler_docs
	ORDER BY colbert <~> turbohybrid_query(
	  multivector_query => turbohybrid_multivector(ARRAY[
	    '[1,0]'::vector,
	    '[0,1]'::vector
	  ]),
	  text_query => to_tsquery('simple', 'common | needle'),
	  fusion => 'rrf'
	)
	LIMIT 1;

	stats := turbohybrid_last_scan_stats();
	IF top_id IS NULL OR
		stats->>'hybrid_budget_policy' <> 'adaptive' OR
		stats->>'multivector_candidate_source' <> 'document_nodes' OR
		stats->>'multivector_graph_mode' <> 'document_nodes' OR
		stats->>'hybrid_budget_reason' <>
			'admission_document_dense_reduce_bm25' OR
		(stats->>'hybrid_bm25_k_chosen')::int >= 64 OR
		stats->>'fusion_strategy' NOT IN ('sorted_merge_doc', 'hash_doc') THEN
		RAISE EXCEPTION 'expected branch-aware document-node hybrid scheduler stats, top %, stats %',
			top_id, stats;
	END IF;
END
$$;
DROP TABLE mv_docnode_hybrid_scheduler_docs;
CREATE TABLE mv_weighted_docs (
  id int,
  colbert turbohybrid_multivector,
  body_tsv tsvector
);
INSERT INTO mv_weighted_docs VALUES
  (1, turbohybrid_multivector(ARRAY['[1,0]'::vector]), to_tsvector('alpha')),
  (2, turbohybrid_multivector(ARRAY['[1,0]'::vector]), to_tsvector('beta')),
  (3, turbohybrid_multivector(ARRAY['[-1,0]'::vector]), to_tsvector('alpha'));
CREATE INDEX mv_weighted_docs_idx ON mv_weighted_docs USING turbohybrid
  (colbert multivector_cosine_turbohybrid_ops,
   body_tsv bm25_tsvector_turbohybrid_ops);
DO $$
DECLARE
	top_id int;
BEGIN
	SELECT id INTO top_id FROM mv_weighted_docs
		ORDER BY colbert <~> turbohybrid_query(
			multivector_query => turbohybrid_multivector(ARRAY['[1,0]'::vector]),
			text_query => to_tsquery('alpha'),
			dense_k => 2,
			bm25_k => 2,
			final_k => 3,
			fusion => 'weighted',
			alpha => 0.5
		)
		LIMIT 1;
	IF top_id <> 1 THEN
		RAISE EXCEPTION 'expected weighted fusion to rank both-evidence doc first, got %',
			top_id;
	END IF;
END
$$;
DO $$
DECLARE
	result_count int;
	result_id int;
	seen_ids int[] := ARRAY[]::int[];
BEGIN
	result_count := 0;
	FOR result_id IN
		SELECT id FROM mv_weighted_docs
			ORDER BY colbert <~> turbohybrid_query(
				multivector_query => turbohybrid_multivector(ARRAY['[1,0]'::vector]),
				text_query => to_tsquery('alpha'),
				dense_k => 2,
				bm25_k => 2,
				final_k => 3,
				fusion => 'weighted',
				alpha => 0.5
			)
			LIMIT 3
	LOOP
		result_count := result_count + 1;
		IF result_id = ANY(seen_ids) THEN
			RAISE EXCEPTION 'expected weighted fusion to deduplicate docs, saw duplicate doc %',
				result_id;
		END IF;
		seen_ids := seen_ids || result_id;
	END LOOP;
	IF result_count < 1 THEN
		RAISE EXCEPTION 'expected weighted fusion to return at least one doc';
	END IF;
END
$$;
SELECT bool_and(id IN (1, 3)) AS weighted_require_bm25_match
FROM (
  SELECT id FROM mv_weighted_docs
    ORDER BY colbert <~> turbohybrid_query(
      multivector_query => turbohybrid_multivector(ARRAY['[1,0]'::vector]),
      text_query => to_tsquery('alpha'),
      dense_k => 2,
      bm25_k => 2,
      final_k => 3,
      fusion => 'weighted',
      alpha => 0.5,
      require_bm25_match => true
    )
    LIMIT 3
) s;
weighted_require_bm25_match
t
(1 row)
DROP TABLE mv_weighted_docs;
SET turbohybrid.multivector_max_query_vectors = 1;
SELECT id FROM mv_docs
  ORDER BY colbert <~> turbohybrid_query(
    multivector_query => turbohybrid_multivector(ARRAY['[1,0]'::vector, '[0,1]'::vector]),
    dense_k => 6,
    final_k => 1
  )
  LIMIT 1;
ERROR:  multivector token count 2 exceeds configured limit 1
RESET turbohybrid.multivector_max_query_vectors;
SET turbohybrid.multivector_max_dim = 1;
SELECT id FROM mv_docs
  ORDER BY colbert <~> turbohybrid_query(
    multivector_query => turbohybrid_multivector(ARRAY['[1,0]'::vector]),
    dense_k => 6,
    final_k => 1
  )
  LIMIT 1;
ERROR:  multivector dimensions 2 exceed configured limit 1
RESET turbohybrid.multivector_max_dim;
SET turbohybrid.multivector_max_raw_hits_per_token = 1;
SELECT id FROM mv_docs
  ORDER BY colbert <~> turbohybrid_query(
    multivector_query => turbohybrid_multivector(ARRAY['[1,0]'::vector]),
    dense_k => 6,
    final_k => 1
  )
  LIMIT 1;
id
1
(1 row)
DO $$
DECLARE
	stats jsonb;
BEGIN
	stats := turbohybrid_last_scan_stats();
	IF (stats->>'multivector_raw_subvector_hits')::int > 1 THEN
		RAISE EXCEPTION 'expected raw-hit cap to be respected, got %', stats;
	END IF;
END
$$;
RESET turbohybrid.multivector_max_raw_hits_per_token;
DELETE FROM mv_docs WHERE id = 4;
VACUUM mv_docs;
SELECT COALESCE(bool_or(id = 4), false) AS deleted_doc_returned
FROM (
  SELECT id FROM mv_docs
    ORDER BY colbert <~> turbohybrid_query(
      multivector_query => turbohybrid_multivector(ARRAY['[-1,-1]'::vector]),
      dense_k => 8,
      final_k => 3
    )
    LIMIT 3
) s;
deleted_doc_returned
f
(1 row)
DO $$
DECLARE
	stats jsonb;
BEGIN
	stats := turbohybrid_last_scan_stats();
	IF stats->>'multivector_docmap_source' <> 'sidecar' THEN
		RAISE EXCEPTION 'expected post-delete scan to keep using sidecar, got %',
			stats;
	END IF;
END
$$;
CREATE TABLE mv_lifecycle_docs (
  id int PRIMARY KEY,
  colbert turbohybrid_multivector,
  body_tsv tsvector
);
INSERT INTO mv_lifecycle_docs VALUES
  (1, turbohybrid_multivector(ARRAY['[1,0]'::vector]), to_tsvector('delete_me')),
  (2, turbohybrid_multivector(ARRAY['[-1,0]'::vector]), to_tsvector('old_update')),
  (3, turbohybrid_multivector(ARRAY['[-1,0]'::vector]), to_tsvector('hybrid_old'));
CREATE INDEX mv_lifecycle_idx ON mv_lifecycle_docs USING turbohybrid
  (colbert multivector_cosine_turbohybrid_ops,
   body_tsv bm25_tsvector_turbohybrid_ops);
SET enable_seqscan = off;
DELETE FROM mv_lifecycle_docs WHERE id = 1;
SELECT COALESCE(bool_or(id = 1), false) AS lifecycle_deleted_before_vacuum
FROM (
  SELECT id FROM mv_lifecycle_docs
    ORDER BY colbert <~> turbohybrid_query(
      multivector_query => turbohybrid_multivector(ARRAY['[1,0]'::vector]),
      dense_k => 6,
      final_k => 3
    )
    LIMIT 3
) s;
lifecycle_deleted_before_vacuum
f
(1 row)
VACUUM mv_lifecycle_docs;
SELECT COALESCE(bool_or(id = 1), false) AS lifecycle_deleted_after_vacuum
FROM (
  SELECT id FROM mv_lifecycle_docs
    ORDER BY colbert <~> turbohybrid_query(
      multivector_query => turbohybrid_multivector(ARRAY['[1,0]'::vector]),
      dense_k => 6,
      final_k => 3
    )
    LIMIT 3
) s;
lifecycle_deleted_after_vacuum
f
(1 row)
UPDATE mv_lifecycle_docs
SET colbert = turbohybrid_multivector(ARRAY['[1,0]'::vector]),
    body_tsv = to_tsvector('updated_dense')
WHERE id = 2;
SELECT id AS lifecycle_updated_dense_top FROM mv_lifecycle_docs
  ORDER BY colbert <~> turbohybrid_query(
    multivector_query => turbohybrid_multivector(ARRAY['[1,0]'::vector]),
    dense_k => 6,
    final_k => 1
  )
  LIMIT 1;
lifecycle_updated_dense_top
2
(1 row)
SELECT id AS lifecycle_old_update_top FROM mv_lifecycle_docs
  ORDER BY colbert <~> turbohybrid_query(
    multivector_query => turbohybrid_multivector(ARRAY['[-1,0]'::vector]),
    dense_k => 6,
    final_k => 1
  )
  LIMIT 1;
lifecycle_old_update_top
3
(1 row)
UPDATE mv_lifecycle_docs
SET colbert = turbohybrid_multivector(ARRAY['[0,1]'::vector]),
    body_tsv = to_tsvector('hybrid_new')
WHERE id = 3;
SELECT id AS lifecycle_hybrid_update_top FROM mv_lifecycle_docs
  ORDER BY colbert <~> turbohybrid_query(
    multivector_query => turbohybrid_multivector(ARRAY['[0,1]'::vector]),
    text_query => to_tsquery('hybrid_new'),
    dense_k => 6,
    bm25_k => 6,
    final_k => 1,
    fusion => 'rrf'
  )
  LIMIT 1;
lifecycle_hybrid_update_top
3
(1 row)
CREATE TEMP TABLE mv_lifecycle_before_insert AS
SELECT (turbohybrid_index_stats('mv_lifecycle_idx'::regclass)->>'node_count')::int AS node_count;
INSERT INTO mv_lifecycle_docs VALUES
  (4, turbohybrid_multivector(ARRAY[
    '[-0.2,-0.8]'::vector,
    '[-0.4,-0.6]'::vector,
    '[-0.6,-0.4]'::vector
  ]), to_tsvector('insert_after_vacuum'));
DO $$
DECLARE
	before_count int;
	after_count int;
BEGIN
	SELECT node_count INTO before_count FROM mv_lifecycle_before_insert;
	after_count := (turbohybrid_index_stats('mv_lifecycle_idx'::regclass)->>'node_count')::int;
	IF after_count <= before_count THEN
		RAISE EXCEPTION 'expected post-vacuum multivector insert to increase node_count, before %, after %',
			before_count, after_count;
	END IF;
END
$$;
SELECT id AS lifecycle_insert_after_vacuum_top FROM mv_lifecycle_docs
  ORDER BY colbert <~> turbohybrid_query(
    multivector_query => turbohybrid_multivector(ARRAY['[-0.2,-0.8]'::vector]),
    dense_k => 8,
    final_k => 1
  )
  LIMIT 1;
lifecycle_insert_after_vacuum_top
4
(1 row)
DROP TABLE mv_lifecycle_docs;
DROP TABLE mv_lifecycle_before_insert;
SELECT id AS rrf_text_only_top FROM mv_docs
  ORDER BY colbert <~> turbohybrid_query(
    text_query => to_tsquery('gamma'),
    bm25_k => 3,
    final_k => 1,
    fusion => 'rrf'
  )
  LIMIT 1;
rrf_text_only_top
2
(1 row)
SELECT bool_and(id IN (2, 3)) AS rrf_require_bm25_match
FROM (
  SELECT id FROM mv_docs
    ORDER BY colbert <~> turbohybrid_query(
      multivector_query => turbohybrid_multivector(ARRAY['[1,0]'::vector]),
      text_query => to_tsquery('gamma'),
      dense_k => 6,
      bm25_k => 3,
      final_k => 3,
      fusion => 'rrf',
      require_bm25_match => true
    )
    LIMIT 3
) s;
rrf_require_bm25_match
t
(1 row)
EXPLAIN (COSTS OFF)
SELECT id FROM mv_docs
  ORDER BY colbert <~> turbohybrid_query(
    multivector_query => turbohybrid_multivector(ARRAY['[1,0]'::vector]),
    dense_k => 6,
    final_k => 1
  )
  LIMIT 1;
QUERY PLAN
Limit
  ->  Index Scan using mv_docs_hybrid_idx on mv_docs
        Order By: (colbert <~> turbohybrid_query(NULL::vector, NULL::tsquery, 'rrf'::text, '1'::double precision, '1'::double precision, NULL::double precision, NULL::integer, 6, NULL::integer, 1, false, 'turbohybrid_multivector(dim=2,count=1,values=[[1,0]])'::turbohybrid_multivector))
(3 rows)
RESET enable_seqscan;
CREATE TABLE mv_usability_dense_only_docs (
  id int,
  colbert turbohybrid_multivector
);
INSERT INTO mv_usability_dense_only_docs VALUES
  (1, turbohybrid_multivector(ARRAY['[1,0]'::vector]));
CREATE INDEX mv_usability_dense_only_idx ON mv_usability_dense_only_docs USING turbohybrid
  (colbert multivector_cosine_turbohybrid_ops);
SET enable_seqscan = off;
SELECT id FROM mv_usability_dense_only_docs
  ORDER BY colbert <~> turbohybrid_query(
    text_query => to_tsquery('alpha'),
    bm25_k => 1,
    final_k => 1,
    fusion => 'rrf'
  )
  LIMIT 1;
ERROR:  text_query requires a turbohybrid index with a tsvector key
RESET enable_seqscan;
DROP TABLE mv_usability_dense_only_docs;
CREATE TABLE mv_usability_vector_docs (
  id int,
  embedding vector(2)
);
INSERT INTO mv_usability_vector_docs VALUES
  (1, '[1,0]'::vector);
CREATE INDEX mv_usability_vector_idx ON mv_usability_vector_docs USING turbohybrid
  (embedding vector_cosine_turbohybrid_ops);
SET enable_seqscan = off;
SELECT id FROM mv_usability_vector_docs
  ORDER BY embedding <~> turbohybrid_query(
    multivector_query => turbohybrid_multivector(ARRAY['[1,0]'::vector]),
    dense_k => 1,
    final_k => 1
  )
  LIMIT 1;
ERROR:  multivector_query requires a turbohybrid index with a multivector key
RESET enable_seqscan;
DROP TABLE mv_usability_vector_docs;
CREATE INDEX mv_docs_expr_idx ON mv_docs USING turbohybrid
  ((coalesce(colbert, colbert)) multivector_cosine_turbohybrid_ops);
ERROR:  pgturbohybrid expression indexes are not supported yet
SET turbohybrid.multivector_max_doc_vectors = 1;
CREATE INDEX mv_docs_colbert_limited_idx ON mv_docs USING turbohybrid
  (colbert multivector_cosine_turbohybrid_ops);
ERROR:  multivector token count 2 exceeds configured limit 1
RESET turbohybrid.multivector_max_doc_vectors;
CREATE INDEX mv_docs_bad_order_idx ON mv_docs USING turbohybrid
  (body_tsv bm25_tsvector_turbohybrid_ops, colbert multivector_cosine_turbohybrid_ops);
ERROR:  pgturbohybrid first key must be type vector or turbohybrid_multivector
SELECT turbohybrid_index_stats('mv_docs_hybrid_idx'::regclass)->>'multivector_graph_mode'
  AS default_multivector_graph_mode;
default_multivector_graph_mode
token_nodes
(1 row)
CREATE INDEX mv_docs_graph_mode_token_idx ON mv_docs USING turbohybrid
  (colbert multivector_cosine_turbohybrid_ops)
  WITH (multivector_graph = token_nodes);
SELECT turbohybrid_index_stats('mv_docs_graph_mode_token_idx'::regclass)->>'multivector_graph_mode'
  AS explicit_multivector_graph_mode;
explicit_multivector_graph_mode
token_nodes
(1 row)
CREATE TABLE mv_document_node_docs (
  id int PRIMARY KEY,
  colbert turbohybrid_multivector
);
INSERT INTO mv_document_node_docs VALUES
  (1, turbohybrid_multivector(ARRAY['[1,0]'::vector, '[0.8,0.2]'::vector])),
  (2, turbohybrid_multivector(ARRAY['[0,1]'::vector, '[0.2,0.8]'::vector])),
  (3, turbohybrid_multivector(ARRAY['[0.95,0.05]'::vector, '[0,1]'::vector]));
CREATE INDEX mv_document_node_docs_idx ON mv_document_node_docs USING turbohybrid
  (colbert multivector_cosine_turbohybrid_ops)
  WITH (multivector_graph = document_nodes, graph_ef_search = 2);
SELECT turbohybrid_index_stats('mv_document_node_docs_idx'::regclass)->>'multivector_graph_mode'
  AS document_node_graph_mode,
       (turbohybrid_index_stats('mv_document_node_docs_idx'::regclass)->>'node_count')::int
  AS document_node_count;
document_node_graph_mode|document_node_count
document_nodes|3
(1 row)
SET enable_seqscan = off;
SET turbohybrid.multivector_plain_fallback = off;
SELECT id AS document_node_top1
FROM mv_document_node_docs
ORDER BY colbert <~> turbohybrid_query(
  multivector_query => turbohybrid_multivector(ARRAY['[1,0]'::vector]),
  dense_k => 3,
  final_k => 1
)
LIMIT 1;
document_node_top1
1
(1 row)
DO $$
DECLARE
	stats jsonb;
BEGIN
	stats := turbohybrid_last_scan_stats();
	IF stats->>'multivector_graph_mode' <> 'document_nodes' OR
		stats->>'multivector_docmap_source' <> 'sidecar' OR
		(stats->>'multivector_doc_graph_nodes')::int <> 3 OR
		(stats->>'multivector_doc_graph_candidates')::int <> 3 OR
		(stats->>'multivector_doc_graph_quantized_scores')::int <> 0 OR
		(stats->>'multivector_doc_graph_exact_rerank_docs')::int < 1 OR
		stats->>'multivector_doc_graph_warning' <> 'document_node_f32_sidecar_exact_scan' THEN
		RAISE EXCEPTION 'expected document-node graph scan stats, got %',
			stats;
	END IF;
END
$$;
SET turbohybrid.multivector_doc_graph_rescore_k = 1;
SELECT id AS document_node_graph_traversal_probe
FROM mv_document_node_docs
ORDER BY colbert <~> turbohybrid_query(
  multivector_query => turbohybrid_multivector(ARRAY['[1,0]'::vector]),
  dense_k => 1,
  final_k => 1
)
LIMIT 1;
document_node_graph_traversal_probe
1
(1 row)
DO $$
DECLARE
	stats jsonb;
BEGIN
	stats := turbohybrid_last_scan_stats();
	IF stats->>'multivector_graph_mode' <> 'document_nodes' OR
		stats->>'multivector_doc_graph_warning' <> 'document_node_f32_sidecar_graph_traversal' OR
		(stats->>'multivector_doc_graph_nodes')::int <> 3 OR
		(stats->>'multivector_doc_graph_candidates')::int < 1 OR
		(stats->>'multivector_doc_graph_exact_rerank_docs')::int < 1 THEN
		RAISE EXCEPTION 'expected non-exhaustive document-node graph traversal stats, got %',
			stats;
	END IF;
END
$$;
RESET turbohybrid.multivector_doc_graph_rescore_k;
RESET enable_seqscan;
INSERT INTO mv_document_node_docs VALUES
  (4, turbohybrid_multivector(ARRAY['[-1,0]'::vector, '[-0.8,-0.2]'::vector]));
DO $$
DECLARE
	stats jsonb;
BEGIN
	stats := turbohybrid_index_stats('mv_document_node_docs_idx'::regclass);
	IF (stats->>'node_count')::int <> 4 OR
		stats->>'multivector_graph_mode' <> 'document_nodes' THEN
		RAISE EXCEPTION 'expected document-node insert to append one graph node, got %',
			stats;
	END IF;
END
$$;
UPDATE mv_document_node_docs
SET colbert = turbohybrid_multivector(ARRAY['[0,1]'::vector, '[0.1,0.9]'::vector])
WHERE id = 4;
DELETE FROM mv_document_node_docs WHERE id = 2;
VACUUM mv_document_node_docs;
SET enable_seqscan = off;
SELECT id AS document_node_post_vacuum_top1
FROM mv_document_node_docs
ORDER BY colbert <~> turbohybrid_query(
  multivector_query => turbohybrid_multivector(ARRAY['[0,1]'::vector]),
  dense_k => 4,
  final_k => 1
)
LIMIT 1;
document_node_post_vacuum_top1
3
(1 row)
RESET enable_seqscan;
RESET turbohybrid.multivector_plain_fallback;
DROP TABLE mv_document_node_docs;
SELECT turbohybrid_multivector(ARRAY['[1,0]'::vector]) <~>
  turbohybrid_query(vector_query => '[1,0]'::vector);
ERROR:  turbohybrid_query requires multivector_query for multivector distance
SET enable_seqscan = off;
SELECT id FROM mv_docs
  ORDER BY colbert <~> turbohybrid_query(
    vector_query => '[1,0]'::vector,
    dense_k => 1,
    final_k => 1
  )
  LIMIT 1;
ERROR:  vector_query requires a turbohybrid index with a vector key
RESET enable_seqscan;
DROP TABLE mv_docs;
\set VERBOSITY terse
SELECT turbohybrid_multivector(ARRAY[]::vector[]);
ERROR:  vector array cannot be empty
SELECT turbohybrid_multivector(ARRAY['[1,0]'::vector, NULL::vector]);
ERROR:  vector array cannot contain null elements
SELECT turbohybrid_multivector(ARRAY['[1,0]'::vector, '[1,0,0]'::vector]);
ERROR:  all vectors in a multivector must have the same dimensions
SELECT turbohybrid_multivector_maxsim(
  turbohybrid_multivector(ARRAY['[1,0]'::vector]),
  turbohybrid_multivector(ARRAY['[1,0,0]'::vector])
);
ERROR:  different multivector dimensions 2 and 3
DO $$
DECLARE
	literal text;
BEGIN
	FOREACH literal IN ARRAY ARRAY[
		'turbohybrid_multivector(dim=2,count=2,values=[[1,0]])',
		'turbohybrid_multivector(dim=2,count=1,values=[[1]])',
		'turbohybrid_multivector(dim=2,count=1,values=[1,0])',
		'turbohybrid_multivector(dim=2,count=1,values=[[NaN,0]])',
		'turbohybrid_multivector(dim=2,count=1,values=[[Inf,0]])',
		'turbohybrid_multivector(dim=2,count=1,values=[[1,0]]) trailing'
	]
	LOOP
		BEGIN
			EXECUTE format('SELECT %L::turbohybrid_multivector', literal);
			RAISE EXCEPTION 'expected malformed multivector literal to fail: %', literal;
		EXCEPTION WHEN invalid_text_representation OR data_exception THEN
			NULL;
		END;
	END LOOP;
END
$$;
