-- Sparse-primary node space: sparse-only and sparse+BM25 indexes
-- with no dense/multivector graph.  Node identity comes from a dedicated
-- node-map chain; liveness is delegated to heap-tuple MVCC visibility.
SET client_min_messages = warning;
CREATE EXTENSION IF NOT EXISTS vector;
CREATE EXTENSION IF NOT EXISTS pgturbohybrid;
RESET client_min_messages;
-- ============================================================ sparse-only
CREATE TABLE spp (id int, s turbohybrid_sparse_vector);
INSERT INTO spp VALUES
  (1, turbohybrid_sparse_vector_build(ARRAY[2]::int4[], ARRAY[10.0]::float4[])),
  (2, turbohybrid_sparse_vector_build(ARRAY[2]::int4[], ARRAY[20.0]::float4[])),
  (3, turbohybrid_sparse_vector_build(ARRAY[2]::int4[], ARRAY[30.0]::float4[]));
CREATE INDEX spp_idx ON spp USING turbohybrid (s sparse_ip_turbohybrid_ops)
  WITH (sparse_quant_bits = 0);
SET enable_seqscan = off;
-- The planner uses the sparse-primary index for the <~*> ORDER BY.
EXPLAIN (COSTS OFF)
SELECT id FROM spp ORDER BY s <~*> turbohybrid_query(
  sparse_query => turbohybrid_sparse_vector_build(ARRAY[2]::int4[], ARRAY[1.0]::float4[])) LIMIT 10;
                                                                                                                                                                                                                    QUERY PLAN                                                                                                                                                                                                                     
---------------------------------------------------------------------------------------------------------------------------------------------------------------------------------------------------------------------------------------------------------------------------------------------------------------------------------------------------------------------------------------------------------------------------------------------------
 Limit
   ->  Index Scan using spp_idx on spp
         Order By: (s <~*> turbohybrid_query(NULL::vector, NULL::tsquery, 'rrf'::text, '1'::double precision, '1'::double precision, NULL::double precision, NULL::integer, NULL::integer, NULL::integer, NULL::integer, false, NULL::turbohybrid_multivector, NULL::real[], NULL::boolean[], '1'::double precision, NULL::integer, 'turbohybrid_sparse_vector(count=1)'::turbohybrid_sparse_vector, '1'::double precision, NULL::integer, false))
(3 rows)

-- Base ranking: descending weight -> doc3, doc2, doc1 (distance = -inner product).
SELECT id, round((s <~*> turbohybrid_query(
  sparse_query => turbohybrid_sparse_vector_build(ARRAY[2]::int4[], ARRAY[1.0]::float4[])))::numeric, 2) AS dist
FROM spp ORDER BY s <~*> turbohybrid_query(
  sparse_query => turbohybrid_sparse_vector_build(ARRAY[2]::int4[], ARRAY[1.0]::float4[])) LIMIT 10;
 id |  dist  
----+--------
  3 | -30.00
  2 | -20.00
  1 | -10.00
(3 rows)

-- The scan ran through the native sparse branch (not a heap rescan).
DO $$
DECLARE st jsonb;
BEGIN
  SET LOCAL enable_seqscan = off;
  PERFORM id FROM spp ORDER BY s <~*> turbohybrid_query(
    sparse_query => turbohybrid_sparse_vector_build(ARRAY[2]::int4[], ARRAY[1.0]::float4[])) LIMIT 10;
  st := turbohybrid_last_scan_stats();
  IF st->>'index_shape' != 'sparse' THEN
    RAISE EXCEPTION 'expected sparse index shape: %', st->>'index_shape';
  END IF;
  IF st->>'sparse_branch_used' != 'true' THEN
    RAISE EXCEPTION 'sparse branch should be used on a sparse-primary index: %', st;
  END IF;
END $$;
-- INSERT after build: doc4 weight 25 is searchable via the delta (rank between 2 and 3).
INSERT INTO spp VALUES (4, turbohybrid_sparse_vector_build(ARRAY[2]::int4[], ARRAY[25.0]::float4[]));
SELECT id FROM spp ORDER BY s <~*> turbohybrid_query(
  sparse_query => turbohybrid_sparse_vector_build(ARRAY[2]::int4[], ARRAY[1.0]::float4[])) LIMIT 10;
 id 
----
  3
  4
  2
  1
(4 rows)

-- UPDATE doc1 -> weight 40 (now the top match); the old node is filtered by MVCC.
UPDATE spp SET s = turbohybrid_sparse_vector_build(ARRAY[2]::int4[], ARRAY[40.0]::float4[]) WHERE id = 1;
SELECT id FROM spp ORDER BY s <~*> turbohybrid_query(
  sparse_query => turbohybrid_sparse_vector_build(ARRAY[2]::int4[], ARRAY[1.0]::float4[])) LIMIT 10;
 id 
----
  1
  3
  4
  2
(4 rows)

-- DELETE doc3 (weight 30): it must not appear.
DELETE FROM spp WHERE id = 3;
SELECT id FROM spp ORDER BY s <~*> turbohybrid_query(
  sparse_query => turbohybrid_sparse_vector_build(ARRAY[2]::int4[], ARRAY[1.0]::float4[])) LIMIT 10;
 id 
----
  1
  4
  2
(3 rows)

-- base+delta ranking == REINDEX ranking (REINDEX rebuilds the base from the heap).
DO $$
DECLARE before_ids int[]; after_ids int[];
BEGIN
  SET LOCAL enable_seqscan = off;
  SELECT array_agg(id) INTO before_ids FROM (
    SELECT id FROM spp ORDER BY s <~*> turbohybrid_query(
      sparse_query => turbohybrid_sparse_vector_build(ARRAY[2]::int4[], ARRAY[1.0]::float4[])) LIMIT 10) q;
  REINDEX INDEX spp_idx;
  SELECT array_agg(id) INTO after_ids FROM (
    SELECT id FROM spp ORDER BY s <~*> turbohybrid_query(
      sparse_query => turbohybrid_sparse_vector_build(ARRAY[2]::int4[], ARRAY[1.0]::float4[])) LIMIT 10) q;
  IF before_ids IS DISTINCT FROM after_ids THEN
    RAISE EXCEPTION 'base+delta ranking % != REINDEX ranking %', before_ids, after_ids;
  END IF;
END $$;
DROP TABLE spp;
-- ============================================================ sparse + BM25
CREATE TABLE sppb (id int, body tsvector, s turbohybrid_sparse_vector);
INSERT INTO sppb VALUES
  (1, to_tsvector('english','red apple fruit'), turbohybrid_sparse_vector_build(ARRAY[2]::int4[], ARRAY[10.0]::float4[])),
  (2, to_tsvector('english','green apple'),      turbohybrid_sparse_vector_build(ARRAY[2]::int4[], ARRAY[20.0]::float4[])),
  (3, to_tsvector('english','banana fruit'),     turbohybrid_sparse_vector_build(ARRAY[2]::int4[], ARRAY[30.0]::float4[]));
CREATE INDEX sppb_idx ON sppb USING turbohybrid
  (s sparse_ip_turbohybrid_ops, body bm25_tsvector_turbohybrid_ops)
  WITH (sparse_quant_bits = 0);
-- Pure-sparse ORDER BY on a sparse+BM25 primary index.
SELECT id FROM sppb ORDER BY s <~*> turbohybrid_query(
  sparse_query => turbohybrid_sparse_vector_build(ARRAY[2]::int4[], ARRAY[1.0]::float4[])) LIMIT 10;
 id 
----
  3
  2
  1
(3 rows)

-- Sparse + text RRF fusion on the same index (both branches key on the node map).
SELECT id FROM sppb ORDER BY s <~*> turbohybrid_query(
  sparse_query => turbohybrid_sparse_vector_build(ARRAY[2]::int4[], ARRAY[1.0]::float4[]),
  text_query => to_tsquery('english','fruit'), fusion => 'rrf') LIMIT 10;
 id 
----
  3
  2
  1
(3 rows)

-- Insert + delete propagate to the pure-sparse ranking.
INSERT INTO sppb VALUES (4, to_tsvector('english','fruit salad'),
  turbohybrid_sparse_vector_build(ARRAY[2]::int4[], ARRAY[25.0]::float4[]));
SELECT id FROM sppb ORDER BY s <~*> turbohybrid_query(
  sparse_query => turbohybrid_sparse_vector_build(ARRAY[2]::int4[], ARRAY[1.0]::float4[])) LIMIT 10;
 id 
----
  3
  4
  2
  1
(4 rows)

DELETE FROM sppb WHERE id = 3;
SELECT id FROM sppb ORDER BY s <~*> turbohybrid_query(
  sparse_query => turbohybrid_sparse_vector_build(ARRAY[2]::int4[], ARRAY[1.0]::float4[])) LIMIT 10;
 id 
----
  4
  2
  1
(3 rows)

DROP TABLE sppb;
-- ============================================================ empty build + insert
CREATE TABLE spe (id int, s turbohybrid_sparse_vector);
CREATE INDEX spe_idx ON spe USING turbohybrid (s sparse_ip_turbohybrid_ops)
  WITH (sparse_quant_bits = 0);
INSERT INTO spe VALUES
  (1, turbohybrid_sparse_vector_build(ARRAY[5]::int4[], ARRAY[3.0]::float4[])),
  (2, turbohybrid_sparse_vector_build(ARRAY[5]::int4[], ARRAY[7.0]::float4[]));
SELECT id FROM spe ORDER BY s <~*> turbohybrid_query(
  sparse_query => turbohybrid_sparse_vector_build(ARRAY[5]::int4[], ARRAY[1.0]::float4[])) LIMIT 10;
 id 
----
  2
  1
(2 rows)

DROP TABLE spe;
RESET enable_seqscan;
